{
  "schema_version": "ody-pack-manifest/v2",
  "identity": {
    "pack_id": "example-navigation-basics-en",
    "display_name": "Navigation Basics (Example)",
    "description": "Illustrative example pack: basic orientation and navigation practice. Educational sample content for the ODY format.",
    "category": "knowledge",
    "language": "en",
    "region_codes": []
  },
  "version": {
    "semantic": "1.0.0",
    "built_at": "2026-01-01T00:00:00Z"
  },
  "capabilities": [
    "NAVIGATION",
    "ORIENTATION"
  ],
  "dependencies": {
    "requires": [],
    "optional": []
  },
  "lineage": {
    "source_dataset": "public navigation education (illustrative)",
    "transformations": [
      "normalize",
      "validate",
      "sqlite-fts5-index"
    ],
    "builder_version": "ody-format-builder/2.0.0"
  },
  "freshness": {
    "source_published_at": "2026-01-01",
    "pack_built_at": "2026-01-01",
    "expiry_behavior": "warn"
  },
  "confidence": {
    "technical": 0.6
  },
  "publisher": {
    "publisher_id": "ody-examples",
    "publisher_type": "community"
  },
  "review": {
    "status": "technical_demo"
  },
  "content_governance": {
    "declared_content_class": "NON_MEDICAL_PROCEDURE",
    "license_policy": "CC-BY-4.0"
  },
  "integrity": {
    "hash_algorithm": "sha256",
    "signature_algorithm": "ed25519"
  },
  "files": [
    {
      "filename": "example-navigation-basics-en.sqlite",
      "sha256": "75571cc013b5af182b6aba5d5a201c2116818a22ef2f2684ac3be354f7702d09",
      "size_bytes": 49152,
      "role": "primary"
    }
  ]
}
